{
  "id": "Umbraco.Community.Contentment",
  "name": "Contentment",
  "version": "6.0.0-beta001",
  "allowTelemetry": true,
  "extensions": [
    {
      "type": "bundle",
      "alias": "Umb.Contentment.Bundle",
      "name": "[Contentment] Bundle",
      "js": "/App_Plugins/Contentment/umbraco-contentment.js"
    }
  ]
}
